<?xml version="1.0" encoding="iso-8859-1"?>
<!DOCTYPE Relationships SYSTEM "Relation.dtd">
<Relationships
	DTDVersion="05.05.12"
	>
	<Relationship
		ParentRoleName="ThisDataObject"
		ChildRoleName="DataMethods"
		IsEnforce="False"
		OnParentDelete="DeleteChildren"
		OnChildInsertOrUpdate="PreventIfNoParent"
		>
		<AttributePairs>
			<AttributePair
				ParentAttribute="RepositoryName"
				ChildAttribute="RepositoryName"
			/>
			<AttributePair
				ParentAttribute="DataObjectName"
				ChildAttribute="ObjectName"
			/>
		</AttributePairs>
		<AscendCaption><![CDATA[DataObject]]></AscendCaption>
		<DescendCaption><![CDATA[Method(s)]]></DescendCaption>
		<ErrPreventUpdateParent><![CDATA[]]></ErrPreventUpdateParent>
		<ErrPreventDeleteParent><![CDATA[]]></ErrPreventDeleteParent>
		<ErrPreventInsertOrUpdateChild><![CDATA[]]></ErrPreventInsertOrUpdateChild>
	</Relationship>
</Relationships>