<?xml version="1.0" encoding="iso-8859-1"?>
<!DOCTYPE Relationships SYSTEM "Relation.dtd">
<Relationships
	DTDVersion="05.05.12"
	>
	<Relationship
		IsEnforce="True"
		OnParentUpdate="PreventIfChildren"
		OnParentDelete="DeleteChildren"
		OnChildInsertOrUpdate="PreventIfNoParent"
		CountAggregates="0"
		CountReplicates="0"
		ChildRoleName="DataObject_JN_Groups1"
		ParentRoleName="Group"
		>
		<AscendCaption><![CDATA[Group]]> </AscendCaption>
		<DescendCaption><![CDATA[DataObject_JN_Group(s)]]> </DescendCaption>
		<ErrPreventInsertOrUpdateChild><![CDATA[<System Supplied>]]> </ErrPreventInsertOrUpdateChild>
		<ErrPreventDeleteParent><![CDATA[]]> </ErrPreventDeleteParent>
		<ErrPreventUpdateParent><![CDATA[<System Supplied>]]> </ErrPreventUpdateParent>
		<AttributePairs>
			<AttributePair
				ParentAttribute="RepositoryName"
				ChildAttribute="RepositoryName"
			/>
			<AttributePair
				ParentAttribute="GroupName"
				ChildAttribute="GroupName"
			/>
		</AttributePairs>
	</Relationship>
</Relationships>