<?xml version="1.0" encoding="iso-8859-1"?>
<!DOCTYPE Relationships SYSTEM "Relation.dtd">
<Relationships
	DTDVersion="05.05.12"
	>
	<Relationship
		IsEnforce="True"
		OnParentUpdate="PreventIfChildren"
		OnParentDelete="DeleteChildren"
		OnChildInsertOrUpdate="PreventIfNoParent"
		CountAggregates="1"
		CountReplicates="0"
		ChildRoleName="QueryJoinDataObjects"
		ParentRoleName="QueryObject1"
		>
		<AscendCaption><![CDATA[QueryObject]]> </AscendCaption>
		<DescendCaption><![CDATA[QueryJoinDataObject(s)]]> </DescendCaption>
		<ErrPreventInsertOrUpdateChild><![CDATA[<System Supplied>]]> </ErrPreventInsertOrUpdateChild>
		<ErrPreventDeleteParent><![CDATA[]]> </ErrPreventDeleteParent>
		<ErrPreventUpdateParent><![CDATA[<System Supplied>]]> </ErrPreventUpdateParent>
		<AttributePairs>
			<AttributePair
				ParentAttribute="RepositoryName"
				ChildAttribute="RepositoryName"
			/>
			<AttributePair
				ParentAttribute="QueryObjectName"
				ChildAttribute="QueryObjectName"
			/>
		</AttributePairs>
	</Relationship>
</Relationships>