<?xml version="1.0" encoding="iso-8859-1"?>
<!DOCTYPE Relationships SYSTEM "Relation.dtd">
<Relationships
	DTDVersion="05.05.12"
	>
	<Relationship
		ParentRoleName="ObjectDiff"
		ChildRoleName="FormObjectDiff"
		IsEnforce="True"
		OnParentDelete="DeleteChildren"
		>
		<AttributePairs>
			<AttributePair
				ParentAttribute="ReposName1"
				ChildAttribute="ReposName1"
			/>
			<AttributePair
				ParentAttribute="ObjectName1"
				ChildAttribute="AppName1"
			/>
			<AttributePair
				ParentAttribute="ReposName2"
				ChildAttribute="ReposName2"
			/>
			<AttributePair
				ParentAttribute="ObjectName2"
				ChildAttribute="AppName2"
			/>
			<AttributePair
				ParentAttribute="ObjectType"
				ChildAttribute="ObjectType"
			/>
		</AttributePairs>
		<AscendCaption><![CDATA[Object Difference]]></AscendCaption>
		<DescendCaption><![CDATA[Object Differences]]></DescendCaption>
		<ErrPreventUpdateParent><![CDATA[<System Supplied>]]></ErrPreventUpdateParent>
		<ErrPreventDeleteParent><![CDATA[<System Supplied>]]></ErrPreventDeleteParent>
		<ErrPreventInsertOrUpdateChild><![CDATA[<System Supplied>]]></ErrPreventInsertOrUpdateChild>
	</Relationship>
</Relationships>