<?xml version="1.0" encoding="iso-8859-1"?>
<!DOCTYPE Relationships SYSTEM "Relation.dtd">
<Relationships
	DTDVersion="05.05.12"
	>
	<Relationship
		IsEnforce="True"
		OnParentUpdate="PreventIfChildren"
		OnParentDelete="DeleteChildren"
		OnChildInsertOrUpdate="PreventIfNoParent"
		CountAggregates="0"
		CountReplicates="0"
		ChildRoleName="IndexAttrs"
		ParentRoleName="MyIndex"
		>
		<AscendCaption><![CDATA[IndexDO]]> </AscendCaption>
		<DescendCaption><![CDATA[IndexAttr(s)]]> </DescendCaption>
		<ErrPreventInsertOrUpdateChild><![CDATA[<System Supplied>]]> </ErrPreventInsertOrUpdateChild>
		<ErrPreventDeleteParent><![CDATA[]]> </ErrPreventDeleteParent>
		<ErrPreventUpdateParent><![CDATA[<System Supplied>]]> </ErrPreventUpdateParent>
		<AttributePairs>
			<AttributePair
				ParentAttribute="RepositoryName"
				ChildAttribute="RepositoryName"
			/>
			<AttributePair
				ParentAttribute="DataObjectName"
				ChildAttribute="DataObjectName"
			/>
			<AttributePair
				ParentAttribute="IndexName"
				ChildAttribute="IndexName"
			/>
		</AttributePairs>
	</Relationship>
</Relationships>