<?xml version="1.0" encoding="iso-8859-1"?>
<!DOCTYPE Relationships SYSTEM "Relation.dtd">
<Relationships
	DTDVersion="05.05.12"
	>
	<Relationship
		ParentRoleName="RecordSource"
		ChildRoleName="Transition"
		IsEnforce="True"
		OnParentDelete="DeleteChildren"
		CountAggregates="1"
		>
		<AttributePairs>
			<AttributePair
				ParentAttribute="RepositoryName"
				ChildAttribute="RepositoryName"
			/>
			<AttributePair
				ParentAttribute="ApplicationName"
				ChildAttribute="ApplicationName"
			/>
			<AttributePair
				ParentAttribute="FormName"
				ChildAttribute="FormName"
			/>
			<AttributePair
				ParentAttribute="BusinessObject"
				ChildAttribute="BusinessObject"
			/>
			<AttributePair
				ParentAttribute="RSID"
				ChildAttribute="RSID"
			/>
		</AttributePairs>
		<AscendCaption><![CDATA[RecordSource]]></AscendCaption>
		<DescendCaption><![CDATA[Transition(s)]]></DescendCaption>
		<ErrPreventUpdateParent><![CDATA[<System Supplied>]]></ErrPreventUpdateParent>
		<ErrPreventDeleteParent><![CDATA[<System Supplied>]]></ErrPreventDeleteParent>
		<ErrPreventInsertOrUpdateChild><![CDATA[<System Supplied>]]></ErrPreventInsertOrUpdateChild>
	</Relationship>
</Relationships>