<?xml version="1.0" encoding="iso-8859-1"?>
<!DOCTYPE Relationships SYSTEM "Relation.dtd">
<Relationships
	DTDVersion="05.05.12"
	>
	<Relationship
		IsEnforce="True"
		OnParentUpdate="PreventIfChildren"
		OnParentDelete="DeleteChildren"
		OnChildInsertOrUpdate="InsertParentIfNone"
		CountAggregates="0"
		CountReplicates="0"
		ChildRoleName="Repositories"
		ParentRoleName="Version"
		>
		<AscendCaption><![CDATA[ReposVersion]]> </AscendCaption>
		<DescendCaption><![CDATA[Repository(s)]]> </DescendCaption>
		<ErrPreventInsertOrUpdateChild><![CDATA[]]> </ErrPreventInsertOrUpdateChild>
		<ErrPreventDeleteParent><![CDATA[]]> </ErrPreventDeleteParent>
		<ErrPreventUpdateParent><![CDATA[<System Supplied>]]> </ErrPreventUpdateParent>
		<AttributePairs>
			<AttributePair
				ParentAttribute="Version"
				ChildAttribute="RepositoryVersion"
			/>
		</AttributePairs>
	</Relationship>
</Relationships>