<?xml version="1.0" encoding="iso-8859-1"?>
<!DOCTYPE Relationships SYSTEM "Relation.dtd">
<Relationships
	DTDVersion="05.05.12"
	>
	<Relationship
		IsEnforce="True"
		OnParentUpdate="PreventIfChildren"
		OnParentDelete="DeleteChildren"
		OnChildInsertOrUpdate="PreventIfNoParent"
		CountAggregates="3"
		CountReplicates="0"
		ChildRoleName="RSAttrs"
		ParentRoleName="MyRecorfdSource"
		>
		<AscendCaption><![CDATA[RecordSource]]> </AscendCaption>
		<DescendCaption><![CDATA[RSAttribute(s)]]> </DescendCaption>
		<ErrPreventInsertOrUpdateChild><![CDATA[<System Supplied>]]> </ErrPreventInsertOrUpdateChild>
		<ErrPreventDeleteParent><![CDATA[]]> </ErrPreventDeleteParent>
		<ErrPreventUpdateParent><![CDATA[<System Supplied>]]> </ErrPreventUpdateParent>
		<AttributePairs>
			<AttributePair
				ParentAttribute="RepositoryName"
				ChildAttribute="RepositoryName"
			/>
			<AttributePair
				ParentAttribute="ApplicationName"
				ChildAttribute="ApplicationName"
			/>
			<AttributePair
				ParentAttribute="FormName"
				ChildAttribute="FormName"
			/>
			<AttributePair
				ParentAttribute="BusinessObject"
				ChildAttribute="BusinessObject"
			/>
		</AttributePairs>
	</Relationship>
</Relationships>